level,name,duration,range,component,cast_time,desc,class
5,Raise Dead,1 hour,Touch,VSM ,Instantaneous,(a diamond worth at least 500 gpwhich the spell consumes) You return a dead creature you touch to lifeprovided that it has been dead no longer than 10 days. If the creature's soul is both willing and at liberty to rejoin the bodythe creature returns to life with 1 hit point. This spell also neutralizes any poison and cures nonmagical diseases that affected the creature at the time it died. This spell doesn'thoweverremove magical diseasescursesor similar effectsif these aren't first removed prior to casting the spellthey take effect when the creature returns to life. The spell can't return an undead creature to life. This spell closes all mortal woundsbut it doesn't restore missing body parts. If the creature is lacking body parts or organs integral for its survival - its headfor instance - the spell automatically fails. Coming back from the dead is an ordeal. The target takes a -4 penalty to all attack rollssaving throwsand ability checks. Every time the target finishes a long restthe penalty is reduced by 1 until it disappears.,Paladin
1,Ensnaring Strike,1 bonus action,Self,V,Concentrationup to 1 minute, The next time you hit a creature with a weapon attack before this spell endsa writhing mass of thorny vines appears at the point of impactand the target must succeed on a Strength saving throw or be restrained by the magical vines until the spell ends. A Large or larger creature has advantage on this saving throw. If the target succeeds on the savethe vines shrivel away. While restrained by this spellthe target takes 1d6 piercing damage at the start of each of its turns. A creature restrained by the vines or one that can touch the creature can use its action to make a Strength check against your spell save DC. On a successthe target is freed. At Higher Levels. If you cast this spell using a spell slot of 2nd level or higherthe damage increases by 1d6 for each slot level above 1st.,Paladin (Ancients)
1,Speak with Animals (Ritual),1 action,Self,VS,10 minutes, You gain the ability to comprehend and verbally communicate with beasts for the duration. The knowledge and awareness of many beasts is limited by their intelligencebut at minimumbeasts can give you information about nearby locations and monstersincluding whatever they can perceive or have perceived within the past day. You might be able to persuade a beast to perform a small favor for youat the DM's discretion.,Paladin (Ancients)
2,Misty Step,1 bonus action,Self,V,Instantaneous, Briefly surrounded by silvery mistyou teleport up to 30 feet to an unoccupied space that you can see.,Paladin (Ancients)
2,Moonbeam,1 action,120 feet,VSM ,Concentrationup to 1 minute,(several seeds of any moonseed plant and a piece of opalescent feldspar) A silvery beam of pale light shines down in a 5-footradius40-foot-high cylinder centered on a point within range. Until the spell endsdim light fills the cylinder. When a creature enters the spell's area for the first time on a turn or starts its turn thereit is engulfed in ghostly flames that cause searing painand it must make a Constitution saving throw. It takes 2d10 radiant damage on a failed saveor half as much damage on a successful one. A shapechanger makes its saving throw with disadvantage. If it failsit also instantly reverts to its original form and can't assume a different form until it leaves the spell's light. On each of your turns after you cast this spellyou can use an action to move the beam 60 feet in any direction. At Higher Levels. When you cast this spell using a spell slot of 3rd level or higherthe damage increases by 1d10 for each slot level above 2nd.,Paladin (Ancients)
3,Plant Growth,1 action or 8 hours,150 feet,VS,Instantaneous, This spell channels vitality into plants within a specific area. There are two possible uses for the spellgranting either immediate or long-term benefits. If you cast this spell using 1 actionchoose a point within range. All normal plants in a 100-foot radius centered on that point become thick and overgrown. A creature moving through the area must spend 4 feet of movement for every 1 foot it moves. You can exclude one or more areas of any size within the spell's area from being affected. If you cast this spell over 8 hoursyou enrich the land. All plants in a half-mile radius centered on a point within range become enriched for 1 year. The plants yield twice the normal amount of food when harvested.,Paladin (Ancients)
3,Protection from Energy,1 action,Touch,VS,Concentrationup to 1 hour, For the durationthe willing creature you touch has resistance to one damage type of your choice: acidcoldfirelightningor thunder.,Paladin (Ancients)
4,Ice Storm,1 action,300 feet,VSM ,Instantaneous,(a pinch of dust and a few drops of water) A hail of rock-hard ice pounds to the ground in a 20-foot-radius40-foot-high cylinder centered on a point within range. Each creature in the cylinder must make a Dexterity saving throw. A creature takes 2d8 bludgeoning damage and 4d6 cold damage on a failed saveor half as much damage on a successful one. Hailstones turn the storm's area of effect into difficult terrain until the end of your next turn. At Higher Levels. When you cast this spell using a spell slot of 5th level or higherthe bludgeoning damage increases by 1d8 for each slot level above 4th.,Paladin (Ancients)
4,Stoneskin,1 action,Touch,VSM ,Concentrationup to 1 hour,(diamond dust worth 100 gpwhich the spell consumes) This spell turns the flesh of a willing creature you touch as hard as stone. Until the spell endsthe target has resistance to nonmagical bludgeoningpiercingand slashing damage.,Paladin (Ancients)
5,Commune with Nature (Ritual),1 minute,Self,VS,Instantaneous, You briefly become one with nature and gain knowledge of the surrounding territory. In the outdoorsthe spell gives you knowledge of the land within 3 miles of you. In caves and other natural underground settingsthe radius is limited to 300 feet. The spell doesn't function where nature has been replaced by constructionsuch as in dungeons and towns. You instantly gain knowledge of up to three facts of your choice about any of the following subjects as they relate to the area: ?  terrain and bodies of water ?  prevalent plantsmineralsanimalsor peoples ?  powerful celestialsfeyfiendselementalsor undead ?  influence from other planes of existence ?  buildings For exampleyou could determine the location of powerful undead in the areathe location of major sources of safe drinking waterand the location of any nearby towns.,Paladin (Ancients)
5,Tree Stride,1 action,Self,VS,Concentrationup to 1 minute, You gain the ability to enter a tree and move from inside it to inside another tree of the same kind within 500 feet. Both trees must be living and at least the same size as you. You must use 5 feet of movement to enter a tree. You instantly know the location of all other trees of the same kind within 500 feet andas part of the move used to enter the treecan either pass into one of those trees or step out of the tree you're in. You appear in a spot of your choice within 5 feet of the destination treeusing another 5 feet of movement. If you have no movement leftyou appear within 5 feet of the tree you entered. You can use this transportation ability once per round for the duration. You must end each turn outside a tree. ,Paladin (Ancients)
1,Protection from Evil and Good,1 action,Touch,VSM ,Concentrationup to 10 minutes,(holy water or powdered silver and ironwhich the spell consumes) Until the spell endsone willing creature you touch is protected against certain types of creatures: aberrationscelestialselementalsfeyfiendsand undead. The protection grants several benefits. Creatures of those types have disadvantage on attack rolls against the target. The target also can't be charmedfrightenedor possessed by them. If the target is already charmedfrightenedor possessed by such a creaturethe target has advantage on any new saving throw against the relevant effect.,Paladin (Devotion)
1,Sanctuary,1 bonus action,30 feet,VSM ,1 minute,(a small silver mirror) You ward a creature within range against attack. Until the spell endsany creature who targets the warded creature with an attack or a harmful spell must first make a Wisdom saving throw. On a failed savethe creature must choose a new target or lose the attack or spell. This spell doesn't protect the warded creature from area effectssuch as the explosion of a fireball. If the warded creature makes an attack or casts a spell that affects an enemy creaturethis spell ends.,Paladin (Devotion)
2,Lesser Restoration,1 action,Touch,VS,Instantaneous, You touch a creature and can end either one disease or one condition afflicting it. The condition can be blindeddeafenedparalyzedor poisoned.,Paladin (Devotion)
2,Zone of Truth,1 action,60 feet,VS,10 minutes, You create a magical zone that guards against deception in a 15-foot-radius sphere centered on a point of your choice within range. Until the spell endsa creature that enters the spell's area for the first time on a turn or starts its turn there must make a Charisma saving throw. On a failed savea creature can't speak a deliberate lie while in the radius. You know whether each creature succeeds or fails on its saving throw. An affected creature is aware of the spell and can thus avoid answering questions to which it would normally respond with a lie. Such creatures can be evasive in its answers as long as it remains within the boundaries of the truth.,Paladin (Devotion)
3,Beacon of Hope,1 action,30 feet,VS,Concentrationup to 1 minute, This spell bestows hope and vitality. Choose any number of creatures within range. For the durationeach target has advantage on Wisdom saing throws and death saving throwsand regians the maximum number of hit points possible from any healing.,Paladin (Devotion)
3,Dispel Magic,1 action,120 feet,VS,Instantaneous, Choose any creatureobjector magical effect within range. Any spell of 3rd level or lower on the target ends. For each spell of 4th level or higher on the targetmake an ability check using your spellcasting ability. The DC equals 10 + the spell's level. On a successful checkthe spell ends. At Higher Levels. When you cast this spell using a spell slot of 4th level or higheryou automatically end the effects of a spell on the target if the spell's level is equal to or less than the level of the spell slot you used.,Paladin (Devotion)
4,Freedom of Movement,1 action,Touch,VSM ,1 hour,(a leather strapbound around the arm or a similar appendage) You touch a willing creature. For the durationthe target's movement is unaffected by difficult terrainand spells and other magical effects can neither reduce the target's speed nor cause the target to be paralyzed or restrained. The target can also spend 5 feet of movement to automatically escape from nonmagical restraintssuch as manacles or a creature that has it grappled. Finallybeing underwater imposes no penalties on teh target's movement or attacks.,Paladin (Devotion)
4,Guardian of Faith,1 action,30 feet,V,8 hours, A Large spectral guardian appears and hovers for the duration in an unoccupied space of your choice that you can see within range. The guardian occupies that space and is indistinct except for a gleaming sword and shield emblazoned with the symbol of your deity. Any creature hostile to you that moves to a space within 10 feet of the guardian for the firs ttime on a turn must succeed on a Dexterity saving throw. The creature takes 20 radiant damage on a failed saveor half as much damage on a successful one. The guardian vanishes when it has dealt a total of 60 damage.,Paladin (Devotion)
5,Commune (Ritual),1 minute,Self,VSM ,1 minute,(incense and a vial of holy or unholy water) You contact your deity or a divine proxy and ask up to three questions that can be answered with a yes or no. You must ask your questions before the spell ends. You receive a correct answer for each question.  Divine beings aren't necessarily omniscientso you might receive ⫿unclear? as an answer if a question pertains to information that lies beyond the deity's knowledge. In a case where a one-word answer could be misleading or contrary to the deity's intereststhe DM might offer a short phrase as an answer instead.  If you cast the spell two or more times before finishing your next long restthere is a cumulative 25 percent chance for each casting after the first that you get no answer. The DM makes this roll in secret.  ,Paladin (Devotion)
5,Flame Strike,1 action,60 feet,VSM ,Instantaneous,(pinch of sulfur) A vertical column of divine fire roars down from the heavens in a location you specify. Each creature in a 10-foot radius40-foot-high cylinder centered on a point within range must make a Dexterity saving throw. A creature takes 4d6 fire damage and 4d6 radiant damage on a failed saveor half as much damage on a successful one. At Higher Levels. When you cast this spell using a spell slot of 6th level or higherthe fire damage or the radiant damage (your choice) inceases by 1d6 for each slot level above 5th.,Paladin (Devotion)
1,Hellish Rebuke,1 reaction,60 feet,VS,Instantaneous, Reaction: you are being damaged by a creature within 60 feet of you that you can see You point your fingerand the creature that damaged you is momentarily surrounded by hellish flames. The creature must make a Dexterity saving throw. It takes 2d10 fire damage on a failed saveor half as much damage on a successful one. At Higher Levels. When you cast this spell using a spell slot of 2nd level or higherthe damage increases by 1d10 for each slot level above 1st.,Paladin (Oathbreaker)
1,Inflict Wounds,1 action,Touch,VS,Instantaneous, Make a melee spell attack against a creature you can reach. On a hitthe target takes 3d10 necrotic damage. At Higher Levels. When you cast this spell using a spell slot of 2nd level or higherthe damage increases by 1d10 for each slot level above 1st.,Paladin (Oathbreaker)
2,Crown of Madness,1 action,120 feet,VS,Concentrationup to 1 minute, One humanoid of your choice that you can see within range must succeed on a W isdom saving throw or become charmed by you for the duration. While the target is charmed in this waya twisted crown of jagged iron appears on its headand a madness glows in its eyes. The charmed target must use its action before moving on each of its turns to make a melee attack against a creature other than itself that you mentally choose. The target can act normally on its turn if you choose no creature or if none are within its reach. On your subsequent turnsyou must use your action to maintain control over the targetor the spell ends. Alsothe target can make a Wisdom saving throw at the end of each of its turns. On a successthe spell ends.,Paladin (Oathbreaker)
2,Darkness,1 action,60 feet,VM ,Concentrationup to 10 minutes,(bat fur and a drop of pitch or piece of coal) Magical darkness spreads from a point you choose within range to fill a 15-foot radius sphere for the duration. The darkness spreads around corners. A creature with darkvision can't see through this darknessand nonmagical light can't illuminate it. If the point you choose is on an object you are holding or one that isn't being worn or carriedthe darkness emanates from the object and moves with it. Completely covering the source of the darkness with an opaque objectsuch as a bowl or a helmblocks the darkness. If any of this spell's area overlaps with an area of light created by a spell of 2nd level or lowerthe spell that created the light is dispelled.,Paladin (Oathbreaker)
3,Animate Dead,1 minute,10 feet,VSM ,Instantaneous,(a drop of blooda piece of fleshand a pinch of bone dust)   This spell creates an undead servant. Choose a pile of bones or a corpse of a Medium or Small humanoid within range. Your spell imbues the target with a foul mimicry of liferaising it as an undead creature. THe target becomes a skeleton if you chose bones or a zombie if you chose a corpse (the DM has the creature's game statistics).   On each of your turnsyou can use a bonus action to mentally command any creature you made with this spell if the creature is within 60 feet of you (if you control multiple creaturesyou can command any or all of them at the same timeissuing the same command to each one). You decide what action the creature will take and where it will move during its next turnor you can issue a general commandsuch as to guard a particular chamber or corridor. If you issue no commandsthe creature only defends itself against hostile creatures. Once given an orderthe creature continues to follow it until its task is complete.   The creature is under your control for 24 hoursafter which it stops obeying any command you've given it. To maintain the control of the creature for another 24 hoursyou must cast this spell on the creature again before the current 24-hour period ends. This use of the spell reasserts your control over up to four creatures you have animated with this spellrather than animating a new one.   At Higher Levels. When you cast this spell using a spell slot of 4th level or higheryou animate or reassert control over two additional undead creatures for each slot above 3rd. Each of the creatures must come from a different corpse or pile of bones.,Paladin (Oathbreaker)
3,Bestow Curse,1 action,Touch,VS,Concentrationup to 1 minute, You touch a creatureand that creature must succeed on a Wisdom saving throw or become cursed for the duration of the spell. When you cast this spellchoose the nature of the curse from the following options: ? Choose one ability score. While cursedthe target has disadvantage on ability checks and saving throws made with that ability score. ? While cursedthe target has disadvantage on attack rolls against you. ? While cursedthe target must make a Wisdom saving throw at the start of each of its turns. If it failsit wastes its action that turn doing nothing. ? While the target is cursedyour attacks and spells deal an extra 1d8 necrotic damage to the target. A remove curse spell ends this effect. At the DM's optionyou may choose an alternative curse effectbut it should be no more powerful than those described above. The DM has final say on such a curse's effect. At Higher Levels. If you cast this spell using a spell slot of 4th level or higherthe duration is concentrationup to 10 minutes. If you use a spell slot of 5th level or higherthe duration is 8 hours. If you use a spell slot of 7th level or higherthe duration is 24 hours. If you use a 9th level spell slotthe spell lasts until it is dispelled. Using a spell slot of 5th level or higher grants a duration that doesn't require concentration. ,Paladin (Oathbreaker)
4,Blight,1 action,30 feet,VS,Instantaneous, Necromantic energy washes over a creature of your choice that you can see within rangedraining moisture and vitality from it. The target must make a Constitution saving throw. The target takes 8d8 necrotic damage on a failed saveor half as much damagfe on a successful one. This spell has no effect on undead or constructs. If you target a plant creature or a magical plantit makes the saving throw with disadvantageand the spell deals maximum damage to it. If you target a nonmagical plant that isn't a creaturesuch as a tree or shrubit doesn't make a saving throwit simply withers and dies. At Higer Levels. When you cast this spell using a spell slot of 5th level or higherthe damage increases by 1d8 for each slot level above 4th.,Paladin (Oathbreaker)
4,Confusion,1 action,90 feet,VSM ,Concentrationup to 1 minute,(three nut shells) This spell assaults and twists creatures' mindsspawning delusions and provoking uncontrolled actions. Each creature in a 10-foot-radius sphere centered on a point you choose within range must succeed on a Wisdom saving throw when you cast this spell or be affected by it. An affected target can't take reactions and must roll a d10 at the start of each of its turns to determine its behavior for that turn.  d10   Behavior   1     The creature uses all its movement to move in a random direction. To determine the directionroll a d8 and assign a direction to each die face. The creature doesn't take an action this turn. 2-6    The creature doesn't move or take actions this turn. 7-8    The creature uses its action to make a melee attack against a randomly determined creature within its reach. If there is no creature within its reachthe creature does nothing ths turn. 9-10   The creature can act and move normally. At the end of its turnsan affected target can make a Wisdom saving throw. It it succeedsthis effect ends for that target. At Higher Levels. When you cast this spell using a spell slot of 5th level or higherthe radius of the sphere increases by 5 feet for each slot above 4th. ,Paladin (Oathbreaker)
5,Contagion,1 action,Touch,VS,7 days, Your touch inflicts disease. Make a melee spell attack against a creature within your reach. On a hityou afflict the creature with a disease of your choice from any of the ones described below. At the end of each of the target's turnsit must make a Constitution saving throw. After failing three of these saving throwsthe disease's effects last for the durationand the creature stops making these saves. After succeeding on three of these saving throwsthe creature recovers from the diseaseand the spell ends. Since this spell induces a natural disease in its targetany effect that removes a disease or otherwise ameliorates a disease's effects apply to it. Blinding Sickness. Pain grips the creature's mindand its eyes turn milky white. The creature has disadvantage on Wisdom checks and Wisdom saving throws and is blinded. Filth Fever. A raging fever sweeps through the creature's body. The creature has disadvantage on Strength checksStrength saving throwsand attack rolls that use Strength. Flesh Rot. The creature's flesh decays. The creature has disadvantage on Charisma checks and vulnerability to all damage. Mindfire. The creature's mind becomes feverish. The creature has disadvantage on Intelligence checks and Intelligence saving throwsand the creature behaves as if under the effects of the confusion spell during combat. Seizure. The creature is overcome with shaking. The creature has disadvantage on Dexterity checksDexterity saving throwsand attack rolls that use Dexterity. Slimy Doom. The creature begins to bleed uncontrollably. The creature has disadvantage on Constitution checks and Constitution saving throws. In additionwhenever the creature takes damageit is stunned until the end of its next turn. ,Paladin (Oathbreaker)
5,Dominate Person,1 action,60 feet,VS,Concentrationup to 1 minute, You attempt to beguile a humanoid that you can see within range. It must succeed on a Wisdom saving throw or be charmed by you for the duration. If you or creatures that are friendly to you are fighting itit has advantage on the saving throw. While the target is charmedyou have a telepathic link with it as long as the two of you are on the same plane of existence. You can use this telepathic link to issue commands to the creature while you are conscious (no action required)which it does its best to obey. You can specify a simple and general course of actionsuch as ⫿Attack that creature? ⫿Run over there? or ⫿Fetch that object.? If the creature completes the order and doesn't receive further direction from youit defends and preserves itself to the best of its ability. You can use your action to take total and precise control of the target. Until the end of your next turnthe creature takes only the actions you chooseand doesn't do anything that you don't allow it to do. During this time you can also cause the creature to use a reactionbut this requires you to use your own reaction as well. Each time the target takes damageit makes a new Wisdom saving throw against the spell. If the saving throw succeedsthe spell ends. At Higher Levels. When you cast this spell using a 6th-level spell slotthe duration is concentrationup to 10 minutes. When you use a 7th-level spell slotthe duration is concentrationup to 1 hour. When you use a spell slot of 8th level or higherthe duration is concentrationup to 8 hours. ,Paladin (Oathbreaker)
1,Bane,1 action,30 feet,VSM ,Concentrationup to 1 minute,(a drop of blood) Up to three creatures of your choice that you can see within range must make Charisma saving throws. Whener a target that fails this saving throw makes an attack roll or a saving throw before the spell endsthe target must roll a d4 and subtract the number rolled from the attack roll or saving throw. At Higher Levels. When you cast this spell using a spell slot of 2nd level or higheryou can target one aditional creature for each slot level above 1st.,Paladin (Vengeance)
1,Hunter's Mark,1 bonus action,90 feet,V,Concentrationup to 1 hour, You choose a creature you can see within range and mystically mark it as your quarry. Until the spell endsyou deal an extra 1d6 damage to the target whenever you hit it with a weapon attackand you have advantage on any Wisdom (Perception) or Wisdom (Survival) check you make to find it. If the target drops to 0 hit points before this spell endsyou can use a bonus action on a subsequent turn of yours to mark a new creature. At Higher Levels. When you cast this spell using a spell slot of 3rd or 4th levelyou can maintain your concentration on the spell for up to 8 hours. When you use a spell slot of 5th level or higheryou can maintain your concentration on the spell for up to 24 hours.,Paladin (Vengeance)
