level,name,duration,range,component,cast_time,desc,class
1,Bless,1 action,30 feet,VSM ,Concentrationup to 1 minute,(a sprinkling of holy water) You bless up to three creatures of your choice within range. Whenever a target makes an attack roll or a saving throw before the spell endsthe target can roll a d4 and add the number rolled to the attack roll or saving throw. At Higher Levels. When you cast this spell using a spell slot of 2nd level or higheryou can target one additional creature for each slot level above 1st.,Paladin
1,Command,1 action,60 feet,V,1 round, You speak a one-word command to a creature you can see within range. The target must succeed on a Wisdom saving throw or follow the command on its next turn. The spell has no effect if the target is undeadif it doesn't understand your languageor if your command is directly harmful to it.  Some typical commands and their effects follow. You might issue a command other than one described here. If you do sothe DM determines how the target behaves. If the target can't follow your commandthe spell ends.  Approach. The target moves toward you by the shortest and most direct routeending its turn if it moves within 5 feet of you.  Drop. The target drops whatever it is holding and then ends its turn.  Flee. The target spends its turn moving away from you by the fastest available means.  Grovel. The target falls prone and then ends its turn.  Halt. The target doesn't move and takes no actions. A flying creature stays aloftprovided that it is able to do so. If it must move to stay aloftit flies the minimum distance needed to remain in the air.  At Higher Levels. When you cast this spell using a spell slot of 2nd level or higheryou can affect one additional creature for each slot level above 1st. The creatures must be within 30 feet of each other when you target them.,Paladin
1,Compelled Duel,1 bonus action,30 feet,V,Concentrationup to 1 minute, You attempt to compel a creature into a duel. One creature that you can see within range must make a Wisdom saving throw. On a failed savethe creature is drawn to youcompelled by your divine demand. For the durationit has disadvantage on attack rolls against creatures other than youand must make a Wisdom saving throw each time it attempts to move to a space that is more than 30 feet away from youif it succeeds on this saving throwthis spell doesn't restrict the target's movement for that turn. The spell ends if you attack any other creatureif you cast a spell that targets a hostile creature other than the targetif a creature friendly to you damages the target or casts a harmful spell on itor if you end your turn more than 30 feet away from the target.,Paladin
1,Cure Wounds,1 action,Touch,VS,Instantaneous, A creature you touch regains a number of hit points equal to 1d8 + your spellcasting ability modifier. This spell has no effect on undead or constructs. At Higher Levels. When you cast this spell using a spell slot of 2nd level or higherthe healing increases by 1d8 for each slot level above 1st.,Paladin
1,Detect Evil and Good,1 action,Self,VS,Concentrationup to 10 minutes, For the durationyou know if there is an aberrationcelestialelementalfeyfiendor undead within 30 feet of youas well as where the creature is located. Similarlyyou know if there is a place of object within 30 feet of you that has been magically consecrated or desecrated. The spell can penetrate most barriersbut it is blocked by 1 foot of stone1 inch of common metala thin sheet of leador 3 feet of wood or dirt.,Paladin
1,Detect Magic (Ritual),1 action,Self,VS,Concentrationup to 10 minutes, For the durationyou sense the presence of magic within 30 feet of you. If you sense magic in this wayyou can use your action to see a faint aura around any visible creature or object in the area that bears magicand you learn its school of magicif any. The spell can penetrate most barriersbut is blocked by 1 foot of stone1 inch of common metala thin sheet of leador 3 feet of wood or dirt.,Paladin
1,Detect Poison and Disease,1 action,Self,VSM ,Concentrationup to 10 minutes,(a yew leaf) For the durationyou can sense the presence and location of poisonspoisonous creaturesand diseases within 30 feet of you. You also identify the kind of poisonpoisonous creatureor disease in each case. The spell can penetrate most barriersbut is blocked by 1 foot of stone1 inch of common metala thin sheet of leador 3 feet of wood or dirt.,Paladin
1,Divine Favor,1 bonus action,Self,VS,Concentrationup to 1 minute, Your prayer empowers you with divine radiance. Until the spell endsyour weapon attacks deal and extra 1d4 radiant damage on a hit.,Paladin
1,Heroism,1 action,Touch,VS,Concentrationup to 1 minute, A willing creature you touch is imbued with bravery. Until the spell endsthe creature is immune to being frightened and gains temporary hit points equal to your spellcasting ability modifier at the start of each of its turns. When the spell endsthe target loses any remaining temporary hit points from this spell. At Higher Levels. When you cast this spell using a spell slot of 2nd level or higheryou can target one additional creature for each slot level above 1st.,Paladin
1,Protection from Evil and Good,1 action,Touch,VSM ,Concentrationup to 10 minutes,(holy water or powdered silver and ironwhich the spell consumes) Until the spell endsone willing creature you touch is protected against certain types of creatures: aberrationscelestialselementalsfeyfiendsand undead. The protection grants several benefits. Creatures of those types have disadvantage on attack rolls against the target. The target also can't be charmedfrightenedor possessed by them. If the target is already charmedfrightenedor possessed by such a creaturethe target has advantage on any new saving throw against the relevant effect.,Paladin
1,Purify Food and Drink (Ritual),1 action,10 feet,VS,Instantaneous, All nonmagical food and drink withi na 5-foot-radius sphere centered on a point of your choice within range is purified and rendered free of poison and disease.,Paladin
1,Searing Smite,1 bonus action,Self,V,Concentrationup to 1 minute, The next time you hit a creature with a melee weapon attack during the spell's durationyour weapon flares with white-hot intensitityand the attack deals an extra 1d6 fire damage to the target and causes the target to ignite in flames. At the start of each of its turns until the spell endsthe target must make a Constitution saving throw. On a failed saveit takes 1d6 fire damage. On a successful savethe spells ends. If the target or a creature within 5 feet of it uses an action to put out the flamesor if some other effect douses the flames (such as the target being submerged in water)the spell ends. At Higher Levels. When you cast this spell using a spell slot of 2nd level or higherthe initial extra damage dealt by the attack increases by 1d6 for each slot level above 1st.  ,Paladin
1,Shield of Faith,1 bonus action,60 feet,VSM ,Concentrationup to 10 minutes,(a small parchment with a bit of holy text written on it) A shimmering field appears and surrounds a creature of your choice within rangegranting it a +2 bonus to AC for the duration.,Paladin
1,Thunderous Smite,1 bonus action,Self,V,Concentrationup to 1 minute, The first time you hit with a melee weapon attack during this spell's durationyour weapon rings with thunder that is audible within 300 feet of youand the attack deals an extra 2d6 thunder damage to the target. Additionallyif the target is a creatureit must succeed on a Strength saving throw or be pushed 10 feet away from you and knocked prone.,Paladin
1,Wrathful Smite,1 bonus action,Self,V,Concentrationup to 1 minute, The next time you hit with a melee weapon attack during this spell's durationyour attack deals an extra 1d6 psychic damage. Additionallyif the target is a creatureit must make a Wisdom saving throw or be frightened of you until the spell ends. As an actionthe creature can make a Wisdom check against your spell save DC to steel its resolve and end this spell.,Paladin
2,Aid,1 action,30 feet,VSM ,8 hours,(a tiny strip of white cloth) Your spell bolsters your allies with toughness and resolve. Choose up to three creatures within range. Each target's hit point maximum and current hit points increase by 5 for the duration. At Higher Levels. When you cast this spell using a spell slot of 3rd level or highera target's hit points increase by an additional 5 for each slot level above 2nd.,Paladin
2,Branding Smite,1 bonus action,Self,V,Concentrationup to 1 minute, The next time you hit a creature with a weapon attack before this spell endsthe weapon glemas with astral radiance as you strike. The attack deals an extra 2d6 radiant damage to the targetwhich becomes visible if it is invisibleand the target sheds dim light in a 5-foot radius and can't become invisible until the spell ends. At Higher Levels. When you cast this spell using a spell slot of 3rd level or higherthe extra damage increases by 1d6 for each slot level above 2nd.,Paladin
2,Find Steed,10 minutes,30 feet,VS,Instantaneous, You summon a spirit that assumes the form of an unusually intelligentstrongand loyal steedcreating a long-lasting bond with it. Appearing in an unoccupied space within rangethe steed takes on a form that you choosesuch as a warhorsea ponya camelan elkor a mastiff. (Your DM mught allow other animals to be summoned as steeds.) The steed has the statistics of the chosen formthough it is a celestialfeyor fiend (your choice) instead of its normal type. Additionallyif your steed has an Intelligence of 5 or lessits Intelligence becomes 6and it gains the ability to understand one language of your choice that you speak. Your steed serves you as a mountboth in combat and outand you have an instinctive bond with it that allows you to fight as a seamless unit. While mounted on your steedyou can make any spell you cast that targets only you also target your steed. When the steed drops to 0 hit pointsit disappearsleaving behind no physical form. You can also dismiss your steed at any time as an actioncausing it to disappear. In either casecasting this spell again summons the same steedrestored to its hit point maximum. While your steed is within 1 mile of youyou can communicate with it telepathically. You can't have more than one steed bonded by this spell at a time. As an actionyou can release the steed from its bond at any timecausing it to disappear.,Paladin
2,Lesser Restoration,1 action,Touch,VS,Instantaneous, You touch a creature and can end either one disease or one condition afflicting it. The condition can be blindeddeafenedparalyzedor poisoned.,Paladin
2,Locate Object,1 action,Self,VSM ,Concentrationup to 10 minutes,(a forked twig) Describe or name an object that is familiar to you. You sense the direction to the object's locationas long as that object is within 1000 feet of you. If the object is in motionyou know the direction of its movement. The spell can locate a specific object known to youas long as you have seen it up close - within 30 feet - at least once. Alternativelythe spell can locate the nearest object of a particular kindsuch as a certain kind of appareljewelryfurnituretoolor weapon. This spell can't locate an object if any thickness of leadeven a thin sheetblocks a direct path between you and the object.,Paladin
2,Magic Weapon,1 bonus action,Touch,VS,Concentrationup to 1 hour, You touch a nonmagical weapon. Until the spell endsthat weapon becomes a magic weapon with a +1 bonus to attack rolls and damage rolls.   At Higher Levels. When you cast this spell using a spell slot of 4th level or higherthe bonus increases to +2. When you use a spell slot of 6th level or higherthe bonus increases to +3.,Paladin
2,Protection from Poison,1 action,Touch,VS,1 hour, You touch a creature. If it is poisonedyou neutralize the poison. If more than one poison afflicts the targetyou neutralize on poison that you know is presentor you neutralize one at random. For the durationthe target has advantage on saving throws against being poisonedand it has resistance to poison damage.,Paladin
2,Zone of Truth,1 action,60 feet,VS,10 minutes, You create a magical zone that guards against deception in a 15-foot-radius sphere centered on a point of your choice within range. Until the spell endsa creature that enters the spell's area for the first time on a turn or starts its turn there must make a Charisma saving throw. On a failed savea creature can't speak a deliberate lie while in the radius. You know whether each creature succeeds or fails on its saving throw. An affected creature is aware of the spell and can thus avoid answering questions to which it would normally respond with a lie. Such creatures can be evasive in its answers as long as it remains within the boundaries of the truth.,Paladin
3,Aura of Vitality,1 action,Self (30-foot radius),V,Concentrationup to 1 minute, Healing energy radiates from you in an aura with a 30-foot radius. Until the spell endsthe aura moves with youcentered on you. You can use a bonus action to cause one creature in the aura (including you) to regain 2d6 hit points.,Paladin
3,Blinding Smite,1 bonus action,Self,V,Concentrationup to 1 minute, The next time you hit a creature with a melee weapon attack during this spell's durationyou weapon flares with a bright lightand the attack deals an extra 3d8 radiant damage to the target. Additionallythe target must succeed on a Constitution saving throw or be blinded until the spell ends. A creature blinded by this spell makes another Constitution saving throw at the end of each of its turns. On a successful saveit is no longer blinded.,Paladin
3,Create Food and Water,1 action,30 feet,VS,Instantaneous, You create 45 pounds of food and 30 gallons of water on the ground or in containers within rangeenough to sustain up to fifteen humanoids or five steeds for 24 hours. The food is bland but nourishingand spoils if uneaten after 24 hours. The water is clean and doesn't go bad.,Paladin
3,Crusader's Mantle,1 action,Self,V,Concentrationup to 1 minute, Holy power radiates from you in an aura with a 30-foot radiusawakening boldness in friendly creatures. Until the spell endsthe aura moves with youcentered on you. While in the auraeach nonhostile creature in the aura (including you) deals an extra 1d4 radiant damage when it hits with a weapon attack.,Paladin
3,Daylight,1 action,60 feet,VS,1 hour, A 60-foot-radius sphere of light spreads out from a point you choose within range. The sphere is bright light and sheds dim light for an additional 60 feet. If you chose a point on an object you are holding or one that isn't being worn or carriedthe light shines from the object with and moves with it. Completely covering the affected object with an opaque objectsuch as a bowl or a helblocks the light. If any of this spell's area overlaps with an area of darkness created by a spell of 3rd level or lowerthe spell that created the darkness is dispelled.,Paladin
3,Dispel Magic,1 action,120 feet,VS,Instantaneous, Choose any creatureobjector magical effect within range. Any spell of 3rd level or lower on the target ends. For each spell of 4th level or higher on the targetmake an ability check using your spellcasting ability. The DC equals 10 + the spell's level. On a successful checkthe spell ends. At Higher Levels. When you cast this spell using a spell slot of 4th level or higheryou automatically end the effects of a spell on the target if the spell's level is equal to or less than the level of the spell slot you used.,Paladin
3,Elemental Weapon,1 action,Touch,VS,Concentrationup to 1 hour, A nonmagical weapon you touch becomes a magic weapon. Choose one of the following damage types: acidcoldfirelightningor thunder. For the durationthe weapon has a +1 bonus to attack rolls and deals an extra 1d4 damage of the chosen type when it hits. At Higher Levels. When you cast this spell using a spell slot of 5th or 6th levelthe bonus to attack rolls increases to +2 and the extra damage increases to 2d4. When you use a spell slot of 7th level or higherthe bonus increases to +3 and the extra damage increases to 3d4.,Paladin
3,Magic Circle,1 minute,10 feet,VSM ,1 hour,(holy water or powdered silver and iron worth at least 100 gpwhich the spell consumes) You create a 10-foot-radius20-foot-tall cylinder of magical energy centered on a point on the ground that you can see within range. Glowing runes appear wherever the cylinder intersects with the floor or other surface. Choose one or more of the following types of creatures: celestialselementalsfeyfiendsor undead. The circle affects a creature of the chosen type in the following ways: * The creature can't willingly enter the cylinder by nonmagical means. If the creature tries to use teleportation or interplanar travel to do soit must first succeed on a Charisma saving throw. * The creature has disadvantage on attack rolls against targets within the cylinder. * Targets within the cylinder can't be charmedfrightenedor possessed by the creature. When you cast this spellyou can elect to cause its magic to operate in the reverse directionpreventing a creature of the specified type from leaving the cylinder and protecting targets outside it. At Higher Levels. When you cast this spell using a spell slot of 4th level or higherthe duration increases by 1 hour for each slot level above 3rd.,Paladin
3,Remove Curse,1 action,Touch,VS,Instantaneous, At your touchall curses affecting one creature or object end. If the object is a cursed magic itemits curse remainsbut the spell breaks its owner's attunement to the object so it can be removed or discarded. ,Paladin
3,Revivify,1 action,Touch,VSM ,Instantaneous,(diamonds worth 300 gpwhich the spell consumes) You touch a creature that has died within the last minute. That creature returns to life with 1 hit point. This spell can't return to life a creature that has died of old agenor can it restore any missing body parts.,Paladin
4,Aura of Life,1 action,Self (30-foot radius),V,Concentrationup to 10 minutes, Life-preserving energy radiates from you in an aura with a 30-foot radius. Until the spll endsthe aura moves with youcentered on you. Each nonhostile creature in the aura (including you) has resistance to necrotic damageand its hit point maximum can't be reduced. In additiona nonhostileliving creature regains 1 hit point when it starts its turn in the arua with 0 hit points.,Paladin
4,Aura of Purity,1 action,Self (30-foot radius),V,Concentrationup to 10 minutes, Purifying energy radiates from you in an aura with a 30-foot radius. Until the spell endsthe aura moves with youcentered on you. Each nonhostile creature in the aura (including you) can't become diseasedhas resistance to poison damageand has advantage on saving throws against effects that cause any of the following conditions: blndedcharmeddeafendedfrightenedparalyzedpoisonedand stunned.,Paladin
4,Banishment,1 action,60 feet,VSM ,Concentrationup to 1 minute,(an item distasteful to the target) You attempt to send one creature that you can see within range to another place of existence. The target must succeed on a Charisma saving throw or be banished. If the target is native to the plane of existence you're onyou banish the target to a harmless demiplane. While therethe target is incapacitated. The target remains there until the spell endsat which point the target reappears in the space it left or in the nearest unoccupied space if that space is occupied. If the taret is native to a different plane of existence that the one you're onthe target is banished with a faint popping noisereturning to its home plane. If the spell ends before 1 minute has passedthe target reappears in the space it left or in the nearest unoccupied space if that space is occupied. Otherwisethe target doesn't return. At Higher Levels. When you cast this spell using a spell slot of 5th level or higheryou can target one additional creature for each slot level above 4th.,Paladin
4,Death Ward,1 action,Touch,VS,8 hours, You touch a creature and grant it a measure of protection from death. The first time the target would drop to 0 hit points as a result of taking damagethe target instead drops to 1 hit pointand the spell ends. If the spell is still in effect when the target is subjected to an effect that would kill it instantaneously without dealing damagethat effect is instead negated against the targetand the spells ends.,Paladin
4,Locate Creature,1 action,Self,VSM ,Concentrationup to 1 hour,(a bit of fur from a bloodhound) Describe or name a creature that is familiar to you. You sense the direction to the creature's locationas long as that creature is within 1000 feet of you. If the creature is movingyou know the direction of its movement. The spell can locate a specific creature known to youor the nearest creature of a specific kind (such as a human or a unicorn)so long as you have seen such a creature up close - within 30 feet - at least once. If the creature you described or named is in a different formsuch as being unfer the effects of a polymorph spellthis spell doesn't locate the creature. This spell can't locate a creature if running water at least 10 feet wide blocks a direct path between you and the creature.,Paladin
4,Staggering Smite,1 bonus action,Self,V,Concentrationup to 1 minute, The next time you hit a creature with a melee weapon attack during this spell's durationyour weapon pierces both body and mindand the attack deals an extra 4d6 psychic damage to the target. The target must make a Wisdom saving throw. On a failed saveit has disadvantage on attack rolls and ability checksand can't take reactionsuntil the end of its next turn.,Paladin
5,Banishing Smite,1 bonus action,Self,V,Concentrationup to 1 minute, The next time you hit a creature with a weapon attack before this spell endsyour weapon crackles with forceand the attack deals an extra 5d10 force damage to the target. Additionallyif this attack reduces the target to 50 hit points of feweryou banish it. If the target is native to a different plane of existence than the on you're onthe target disappearsreturning to its home plane. If the target is native to the plane you're onthe creature vanishes into a harmless demiplane. While therethe target is incapacitated. It remains there until the spell endsat which point the tart reappears in the space it left or in the nearest unoccupied space if that space is occupied.,Paladin
5,Circle of Power,1 action,Self (30-foot radius),V,Concentrationup to 10 minutes, Divine energy radiates from youdistorting and diffusing magical energy within 30 feet of you. Until the spell endsthe sphere moves with youcentered on you. For the durationeach friendly creature in the area (including you) has advantage on saving throws against spells and other magical effects. Additionallywhen an affected creature succeeds on a saving throw made against a spell or magical effect that allows it to make a saving throw to take only half damageit instead takes no damage if it succeeds on the saving throws.,Paladin
5,Destructive Wave,1 action,Self (30-foot radius),V,Instantaneous, You strike the groundcreating a burst of divine energy that ripples outward from you. Each creature you choose within 30 feet of you must succeed on a Constitution saving throw or take 5d6 thunder damageas well as 5d6 radiant or necrotic damage (your choice)and be knocked prone. A creature that succeeds on its saving throw takes half as much damage and isn't knocked prone.,Paladin
5,Dispel Evil and Good,1 action,Self,VSM ,Concentrationup to 1 minute,(holy water or powdered silver and iron) Shimmering energy surrounds and protects you from feyundeadand creatures originating from beyond the Material Plane. For the durationcelestialselementalsfeyfiendsand undead have disadvantage on attack rolls against you. You can end the spell early by using either of the following special functions. Break  Enchantment. As your actionyou touch a creature you can reach that is charmedfrightenedor possessed by a celestialan elementala feya fiendor an undead. The creature you touch is no longer charmedfrightenedor possessed by such creatures. Dismissal. As your actionmake a melee spell attack against a celestialan elementala feya fiendor an undead you can reach. On a hityou attempt to drive the creature back to its home plane. The creature must succeed on a Charisma saving throw or be sent back to its home plane (if it isn't there already). If they aren't on their home planeundead are sent to the Shadowfelland fey are sent to the Feywild.,Paladin
5,Geas,1 minute,60 feet,V,30 days, You place a magical command on a creature that you can see within rangeforcing it to carry out some service or refrain from some action or course of actiity as you decide. If the creature can understand youit must succeed on a Wisdom saving throw or become charmed by you for the duration. While the creature is charmed by youit takes 5d10 psychic damage each time it acts in a manner directly counter to your instructionsbut no more than once each day. A creature that can't understand you is unaffected by the spell. You can issue any command you chooseshort of an activity that would result in certain death. Should you issue a suicidal commandthe spell ends. You can end the spell early by using an action to dismiss it. A remove cursegreater restorationor wish spell also ends it. At Higher Levels. When you cast this spell using a spell slot of 7th or 8th levelthe duration is 1 year. When you cast this spell using a spell slot of 9th level the spell lasts until it is ended by one of the spells mentioned above.,Paladin
